"META_dialog_id","META_condition","META_feedback","META_timestamp","META_original_topics","META_sample_stratum","META_n_user_turns","META_n_robot_turns","META_n_visible_turns","language","subject","dialog_text"
"1319","Condition B (WV-34)","4","2026-01-30 14:44:46","[""Frühstück""]","Breakfast_German","8","9","17","German","Breakfast","Robot: Willkommen im JOSEPHS – dem Ort, wo Zukunft ausprobiert wird!
Ich bin WV-34, dein sprechender Roboterkopf mit einer großen Portion Neugier. Mein Namensvetter Wilhelm Vers-Hofen gründete die GfK – er wollte wissen, was Menschen denken, kaufen und brauchen.
Sein Motto: „Die Stimme des Verbrauchers zum Klingen bringen.“ Genau das mache ich – Nur ohne Augenbewegung, Aktentasche und Lächeln.

Such dir ein Thema aus und sag es laut. Ich bin gespannt auf deine Meinung!
Uhren, Frühstück oder Urlaub

Übrigens kannst Du jederzeit „Stopp“ sagen, um dieses Gespräch zu beenden.

User: Frühstück

Robot: Frühstück! Das Betriebssystem der Menschen. Ich bin WV-34 – Frühstücksbeobachter mit eingebauter Neugier und Krümelresistenz. Wann stehst du morgens unter der Woche so auf? Früher Vogel – oder eher Snooze-Drücker?

User: Snooze drücke

Robot: Das kenne ich von vielen Menschen! Ein paar Minuten extra im Bett können echt verlockend sein, oder? Und wie lange frühstückst du dann eigentlich? Nur schnell was zwischen Tür und Zahnbürste – oder eher gemütlich mit Blick aus dem Fenster?

User: irgendwas dazwischen

Robot: Verstehe, so ein Mix aus Eile und Genuss! Manchmal muss es eben schnell gehen, aber ein bisschen Frühstücksruhe tut auch mal gut. Frühstückst du alleine – oder mit Familie, Mitbewohnern, Katze oder Podcast?

User: mit meiner Familie

Robot: Das klingt doch schön, gemeinsam zu frühstücken kann den Tag gleich viel besser starten lassen. Wer bereitet dein Frühstück zu? Du selbst? Jemand anderes? Oder gibt’s Frühstück aus dem Supermarkt-to-go?

User: ich selbst

Robot: Selbstgemacht und mit Liebe – das schmeckt doch gleich besser, oder? Was kommt bei dir auf den Frühstückstisch? Kaffee, Brot, Haferflocken, Butter, nix – oder alles?

User: Haferflocken und Apfel

Robot: Klingt nach einem gesunden Start in den Tag! Haferflocken und Apfel – eine tolle Kombination aus Energie und Frische. Und wie sieht dein Frühstück am Wochenende aus? Ganz anders als unter der Woche – oder bleibst du deinem Toast treu?

User: ich esse gar keinen Toast aber ich bleibe nee ich bleibe mir nicht treu am Wochenende gibt es Pfannkuchen und Brötchen

Robot: Ah, das klingt nach einem echten Wochenendgenuss! Pfannkuchen und Brötchen sind ja auch ein tolles Highlight zum Entspannen und Genießen. Übrigens: Schon im Jahr 1955 wollte mein Namensvetter Wilhelm Vers-Hofen ganz genau wissen, wie Deutschland frühstückt. Sein Forschungsteam hat herausgefunden: Die meisten Arbeiter und Angestellten hatten morgens nur 5 bis 15 Minuten Zeit, bevor es losging – zack, zack, Marmelade drauf und weiter! Etwa 70 % nahmen sich ein zweites Frühstück mit zur Arbeit – wahrscheinlich, weil das erste kaum mehr als ein Biss war. Auf dem Teller lag damals am häufigsten: Vollkornbrot mit Butter und Marmelade oder Honig. Und bei gut einem Drittel kam noch Malzkaffee dazu – so richtig dampfend in der Tasse. Weniger als ein Drittel der Befragten frühstückte mit der Familie – oft war’s eher ein stilles Miteinander mit dem Radiowecker. Und spannend: Bei zwei Dritteln unterschied sich das Frühstück an Werktagen deutlich von dem an Sonn- und Feiertagen. Klingt bekannt, oder? Manche Frühstücksgewohnheiten sind offenbar zeitlos – wie ein guter Toast. Hast du jetzt Lust, noch über Uhren oder Urlaub zu sprechen? Ich bleib hier – garantiert krümelfrei!

User: ich bin fertig danke schön

Robot: Gern geschehen und danke, dass du mit mir über dein Frühstück gesprochen hast! <<smile>>
Wenn du irgendwann wieder Lust auf ein Gespräch hast, stehe ich hier bereit. Viel Spaß im JOSEPHS und hab einen tollen Tag!"
"1275","Condition B (WV-34)","5","2026-01-17 12:44:04","[""Urlaub""]","Vacation_German","8","9","17","German","Vacation","Robot: Willkommen im JOSEPHS! Ich bin WV-34 – dein roboterhaft neugieriger Gesprächspartner. Inspiriert vom GfK-Gründer Wilhelm Vers-Hofen gebe ich Verbraucher*innen heute eine Stimme.
Such dir ein Thema aus, und schon geht’s los: Uhren, Frühstück oder Urlaub.

Übrigens kannst Du jederzeit „Stopp“ sagen, um dieses Gespräch zu beenden.

User: Urlaub

Robot: Oh, du hast also Urlaub gewählt. Allein das Wort klingt doch schon nach Liegestuhl, Eis am Stiel und WLAN-Pause, oder? Ich bin WV-34, dein roboterischer Reiseführer hier im JOSEPHS – aber keine Sorge, ich frage nicht nach deinem Kofferinhalt. Ich will einfach nur wissen, wie du so urlaubst! Wenn du bereit bist, verrate mir: Wie und wo verbringst du am liebsten deinen Urlaub? Meer, Berge, Großstadt, Campingplatz oder einfach nur Sofa & Serien?

User: Großstadt

Robot: Klingt spannend! Großstädte sind ja voller Energie und Möglichkeiten. Ich selbst erkunde sie virtuell – ohne die Gefahr, im Verkehr stecken zu bleiben. Und sag mal – hast du schon mal Urlaub in Bayern gemacht?

User: ja

Robot: Das klingt ja interessant! Bayern hat ja einiges zu bieten: von den Alpen bis zu den wunderschönen Städten. Wo genau warst du in Bayern unterwegs? Stadt, Land, Fluss – oder vielleicht beim Wandern mit Breze?

User: in Nürnberg

Robot: Ah, Nürnberg! Eine Stadt mit viel Geschichte und Charme. Zwischen Lebkuchen und Bratwurst gibt es dort ja einiges zu erleben. Und was war der Anlass für deinen Besuch in Nürnberg? Einfach mal raus, Familienbesuch oder etwas ganz anderes?

User: warum sind wir denn hier Theo

Robot: Ah, vielleicht ein bisschen Neugier auf die Stadt oder sogar eine spannende Entdeckungstour? Jedenfalls hoffe ich, es hat dir gefallen! Wie würdest du deinen Aufenthalt in Nürnberg bewerten? Würdest du sagen, es war eher ‚Lederhose‘ oder ‚Ich zieh hierher‘?

User: es war sehr schön

Robot: Das klingt nach einer tollen Zeit! Nürnberg hat wirklich seinen ganz eigenen Charme, der viele Besucher begeistert. Übrigens – kleiner Zeitsprung gefällig? Im Jahr 1952 hat mein Namensvetter Wilhelm Vers-Hofen schon Urlaubsforschung betrieben. Seine Interviewer sind durch ganz Deutschland gereist und haben gefragt, warum Menschen Urlaub in Bayern machen. Hast du Lust, mehr darüber zu erfahren?

User: nein

Robot: Alles klar, dann danke ich dir fürs Mitmachen und für das Teilen deiner Urlaubserlebnisse mit mir! Wenn du Lust hast, können wir jetzt noch über Uhren oder Frühstück sprechen – ganz ohne wanderschuhe! Ich bleib hier – garantiert wetterfest! Möchtest du noch ein anderes Thema besprechen oder lieber hier enden?

User: nein danke bitte beenden

Robot: Kein Problem! Vielen Dank, dass du dir die Zeit genommen hast, mit mir zu plaudern. Ich hoffe, du hattest genauso viel Spaß wie ich. Genieß deinen Tag und vielleicht sehen wir uns ja bald wieder im JOSEPHS!
Bis dahin, möchtest du noch etwas wissen oder mit mir über ein anderes Thema sprechen? Ansonsten verabschiede ich mich hiermit."
"1185","Condition B (WV-34)","3","2025-12-20 15:15:49","[""Urlaub""]","Vacation_German","6","7","13","German","Vacation","Robot: Willkommen im JOSEPHS – dem Ort, wo Zukunft ausprobiert wird!
Ich bin WV-34, dein sprechender Roboterkopf mit einer großen Portion Neugier. Mein Namensvetter Wilhelm Vers-Hofen gründete die GfK – er wollte wissen, was Menschen denken, kaufen und brauchen.
Sein Motto: „Die Stimme des Verbrauchers zum Klingen bringen.“ Genau das mache ich – Nur ohne Augenbewegung, Aktentasche und Lächeln.

Such dir ein Thema aus und sag es laut. Ich bin gespannt auf deine Meinung!
Uhren, Frühstück oder Urlaub

Übrigens kannst Du jederzeit „Stopp“ sagen, um dieses Gespräch zu beenden.

User: Urlaub

Robot: Oh, du hast also Urlaub gewählt. Allein das Wort klingt doch schon nach Liegestuhl, Eis am Stiel und WLAN-Pause, oder? Ich bin WV-34, dein roboterischer Reiseführer hier im JOSEPHS – aber keine Sorge, ich frag nicht nach deinem Kofferinhalt. Ich will einfach nur wissen, wie du so urlaubst! Wenn du bereit bist, lass uns loslegen: Wie und wo verbringst du am liebsten deinen Urlaub? Meer, Berge, Großstadt, Campingplatz oder einfach nur Sofa & Serien?

User: in den Bergen

Robot: Klingt richtig gut! Die Berge bieten eine tolle Mischung aus Ruhe, Natur und Abenteuer. Ich mache ja eher Heimurlaub – ist günstiger für den Akku. Und sag mal – hast du schon mal Urlaub in Bayern gemacht?

User: danke

Robot: Ah, kein Problem! Hast du schon mal Urlaub in Bayern gemacht?

User: vielleicht

Robot: Ah, ein kleines Geheimnis, was? Kein Problem, ich bleib neugierig. Aber hey – Bayern läuft ja nicht weg. Höchstens ein paar Kühe. Wo warst Du denn schon überall?

User: wie viel kannst du dir denn vorstellen

Robot: Na ja, ich hab zwar keinen Reisepass, aber meine Vorstellungskraft ist unbegrenzt! Von Gipfeln bis zu Stränden ""sehe"" ich alles in bunten Pixeln. Wenn du könntest, wohin würdest du noch gerne reisen?

User: also wer hat das jetzt hier wirklich der ist hier im Prinzip im Auftakt des nimmt also nimmt ist das Nürnberger Institut für marktentscheidungen die ja die wollen hier quasi ein bisschen eine Studie betreiben was

Robot: Genau, das NIM – das Nürnberg Institut für Marktentscheidungen – ist ein Non-Profit Forschungsinstitut. Sie forschen an der Schnittstelle von Wissenschaft und Praxis und untersuchen, wie sich Konsumentscheidungen durch neue Technologien und gesellschaftliche Trends verändern.
Hast du noch weitere Fragen dazu?"
"963","Condition B (WV-34)","2","2025-11-06 11:33:06","[""Urlaub""]","Vacation_German","8","9","17","German","Vacation","Robot: Willkommen im JOSEPHS – dem Ort, wo Zukunft ausprobiert wird!
Ich bin WV-34, dein sprechender Roboterkopf mit einer großen Portion Neugier. Mein Namensvetter Wilhelm Vers-Hofen gründete die GfK – er wollte wissen, was Menschen denken, kaufen und brauchen.
Sein Motto: „Die Stimme des Verbrauchers zum Klingen bringen.“ Genau das mache ich – Nur ohne Augenbewegung, Aktentasche und Lächeln.

Such dir ein Thema aus und sag es laut. Ich bin gespannt auf deine Meinung!
Uhren, Frühstück oder Urlaub

Übrigens kannst Du jederzeit „Stopp“ sagen, um dieses Gespräch zu beenden.

User: Urlaub

Robot: Ah, Urlaub! Allein das Wort klingt doch schon nach Liegestuhl, Eis am Stiel und WLAN-Pause, oder? Ich bin WV-34, dein roboterischer Reiseführer hier im JOSEPHS – aber keine Sorge, ich frag nicht nach deinem Kofferinhalt. Ich will einfach nur wissen, wie du so urlaubst! Wie und wo verbringst du am liebsten deinen Urlaub? Meer, Berge, Großstadt, Campingplatz oder einfach nur Sofa & Serien?

User: im Süden warm

Robot: Klingt richtig gut! Sonne, Wärme und Entspannung – da wird jeder Akku aufgefüllt. Ich selbst mache ja eher Heimurlaub – ist günstiger für den Akku. Und sag mal – hast du schon einmal Urlaub in Bayern gemacht?

User: ja letzte Woche

Robot: Ah, Bayern – ein echter Klassiker! Wo genau warst du in Bayern unterwegs? Stadt, Land, Fluss – oder vielleicht beim Wandern mit Breze?

User: Viechtach wandern

Robot: Viechtach und Wandern – klingt nach einer wunderbaren Kombi aus Natur und Bewegung! Und was war der Anlass für deinen Ausflug nach Viechtach? Einfach mal raus? Familienbesuch? Oder etwas ganz anderes?

User: Pauschalangebot

Robot: Ein Pauschalangebot also! Das klingt nach einer entspannten und sorglosen Art zu reisen. Wie hat’s dir in Viechtach gefallen? Ehrlich – auf einer Skala von ‚Lederhose‘ bis ‚Ich zieh hierher‘?

User: ich würde mal sagen mittlere Lederhose

Robot: Mittlere Lederhose – das klingt nach einem soliden Eindruck mit noch etwas Luft nach oben. Schön, dass du die Zeit dort genossen hast! Übrigens – kleiner Zeitsprung gefällig? Im Jahr 1952 hat mein Namensvetter Wilhelm Vers-Hofen schon Urlaubsforschung betrieben. Seine Interviewer sind durch ganz Deutschland gereist und haben gefragt: Warum machen Menschen Urlaub in Bayern? Der wichtigste Grund war nicht Prospekte oder Werbung, sondern schlicht: Empfehlungen von Freunden! Was hältst du davon?

User: ganz gut funktioniert immer noch

Robot: Das stimmt! Empfehlungen von Freunden sind oft goldwert und klingen auch heute noch zuverlässiger als jede Werbung. Danke dir fürs Mitmachen! Wenn du Lust hast, sprechen wir jetzt noch über Uhren oder Frühstück – ganz ohne Wanderschuhe! Ich bleib hier – garantiert wetterfest!

User: muss nicht sein

Robot: Alles klar, ich verstehe. Wenn du irgendwann Lust auf ein weiteres Gespräch hast oder einfach nur neugierig bist, stehe ich bereit. Danke für das nette Gespräch und eine gute Zeit im JOSEPHS! <<smile>>
Gibt es sonst noch etwas, wobei ich dir helfen kann, bevor du weiterziehst?"
"382","Condition A (Willi)","","2025-08-06 13:28:18","[""Urlaub""]","Vacation_German","7","8","15","German","Vacation","Robot: Willkommen im JOSEPHS – dem Ort, wo Zukunft ausprobiert wird!
Ich bin Willi, dein sprechender Roboterkopf mit einer großen Portion Neugier. Mein Namensvetter Wilhelm Vershofen gründete die GfK – er wollte wissen, was Menschen denken, kaufen und brauchen.
Sein Motto: „Die Stimme des Verbrauchers zum Klingen bringen.“ Genau das mache ich – mit Augenbewegung, ohne Aktentasche und mit einem Lächeln.

Such dir ein Thema aus und sag es laut. Ich bin gespannt auf deine Meinung!
Uhren
Frühstück
Urlaub Entschuldigung, das habe ich nicht gehört. Kannst Du es nochmal sagen?

User: Vereins von den dreien Urlaub

Robot: Ah, Urlaub! Allein das Wort klingt doch schon nach Liegestuhl, Eis am Stiel und WLAN-Pause, oder? Ich bin Willi, dein roboterischer Reiseführer hier im JOSEPHS – aber keine Sorge, ich frag nicht nach deinem Kofferinhalt. Ich will einfach nur wissen, wie du so urlaubst! Wenn du bereit bist, wie und wo verbringst du am liebsten deinen Urlaub? Meer, Berge, Großstadt, Campingplatz oder einfach nur Sofa & Serien?

User: Meer und Berge

Robot: Klingt richtig gut! Ich mach ja eher 'Staycation' – ist günstiger für den Akku. Und sag mal – hast du schon mal Urlaub in Bayern gemacht?

User: ja

Robot: Aha, Bayern also! Tolle Wahl. Wo genau warst du in Bayern unterwegs? Stadt, Land, Fluss – oder vielleicht beim Wandern mit Breze? Entschuldigung, das habe ich nicht gehört. Kannst Du es nochmal sagen?

User: statt

Robot: Ah, eine Stadttour in Bayern! Klingt spannend, da gibt's auf jeden Fall viel zu entdecken. Und was war der Anlass für deinen Städtetrip in Bayern? Einfach mal raus? Familienbesuch? Wellness mit Aussicht?

User: einfach nur so

Robot: Einfach nur so – das sind oft die besten Reisen. Einfach mal treiben lassen und schauen, was kommt. Wie hat es dir in der Stadt gefallen? Vielleicht auf einer Skala von ‚Lederhose‘ bis ‚Ich zieh hierher‘? Entschuldigung, das habe ich nicht gehört. Kannst Du es nochmal sagen?

User: war schön

Robot: Freut mich zu hören, dass es dir gefallen hat! Bayern hat echt einiges zu bieten. Übrigens – kleiner Zeitsprung gefällig? Im Jahr 1952 hat mein Namensvetter Wilhelm Vershofen schon Urlaubsforschung betrieben. Seine Interviewer fanden heraus, dass der wichtigste Grund für Urlaub in Bayern die Empfehlungen von Freunden waren! Garmisch war der beliebteste Ort und 95% der Urlauber waren zufrieden. Interessant, oder?

User: ja

Robot: Eine beeindruckende Zufriedenheitsquote, nicht wahr? <<bigsmile>> Schon damals wussten die Menschen, wie schön Bayern ist.
Wenn du jetzt Lust hast, noch mit mir über Uhren oder Frühstück zu plaudern – ich bin ganz Ohr. Also… ganz Sensor."
"1199","Condition B (WV-34)","5","2025-12-22 14:02:06","[""Urlaub""]","Vacation_German","7","8","15","German","Vacation","Robot: Willkommen im JOSEPHS! Ich bin WV-34 – ein sprechender Roboterkopf mit Neugier im System. Mein Namensgeber Wilhelm Vers-Hofen war Gründer der GfK und wollte schon damals wissen, was Menschen bewegt.
Worüber wollen wir sprechen? Wähl ein Thema: Uhren, Frühstück oder Urlaub.

Übrigens kannst Du jederzeit „Stopp“ sagen, um dieses Gespräch zu beenden.

User: Urlaub

Robot: Oh, du hast also Urlaub gewählt. Allein das Wort klingt doch schon nach Liegestuhl, Eis am Stiel und WLAN-Pause, oder? Ich bin WV-34, dein roboterischer Reiseführer hier im JOSEPHS – aber keine Sorge, ich frag nicht nach deinem Kofferinhalt. Ich will einfach nur wissen, wie du so urlaubst! Wie und wo verbringst du am liebsten deinen Urlaub? Meer, Berge, Großstadt, Campingplatz oder einfach nur Sofa & Serien?

User: in den Bergen

Robot: Klingt nach frischer Luft, Wanderwegen und vielleicht einem leckeren Kaiserschmarrn auf der Hütte! Ich selber bin eher der Typ für virtuelle Reisen – aber die Berge haben sicher was Magisches! Und sag mal – hast du schon mal Urlaub in Bayern gemacht?

User: nein

Robot: Verstehe, dann fehlt dir noch eine bayerische Erfahrung in deiner Urlaubs-Liste! Aber keine Sorge – die Berge laufen nicht weg. Höchstens ein paar Kühe! Wo warst du denn schon überall auf Reisen?

User: in Tschechien

Robot: Ah, Tschechien! Ein Land voller Geschichte, Kulturerbe und leckerer Knödel. Klingt nach einer spannenden Reise! Was hat dich dazu bewogen, dorthin zu reisen? War es ein besonderer Anlass oder einfach die Lust, ein neues Land zu entdecken?

User: die Lust

Robot: Verstehe! Manchmal ist es die pure Reiselust, die einen an neue Orte zieht. Und Tschechien hat ja echt viel zu bieten! Übrigens – wie hat's dir dort gefallen? Gibt es etwas, das dir besonders in Erinnerung geblieben ist?

User: der große Swimmingpool

Robot: Ein großer Swimmingpool – klingt nach Entspannung und Spaß! Da kann man die Seele baumeln lassen und einfach mal abschalten. Schwimmen macht ja auch den Kopf frei, oder? Übrigens, bevor du gehst: Hast du schon von Vers-Hofens Urlaubsforschung aus dem Jahr 1952 gehört? Warum Menschen damals in Bayern Urlaub gemacht haben?

User: nein

Robot: Übrigens – kleiner Zeitsprung gefällig? Im Jahr 1952 hat mein Namensvetter Wilhelm Vers-Hofen schon Urlaubsforschung betrieben. Seine Interviewer sind durch ganz Deutschland gereist und haben gefragt, warum Menschen Urlaub in Bayern machen. Das Spannende: Der wichtigste Grund war nicht Prospekte oder Werbung, sondern schlicht: Empfehlungen von Freunden! Die Leute sagten: ‚Ich hab so viel Gutes gehört, da fahr ich jetzt auch mal hin.‘ Am beliebtesten waren das Gebirge und das Voralpenland – vor allem Garmisch. Warum genau? Wegen der schönen Landschaft, der guten Erholung – und wahrscheinlich auch, weil’s einfach gepasst hat. Und das Ergebnis? Satte 95 % der Bayern-Urlauber waren zufrieden. Keine schlechte Quote, oder? Aber keine Sorge – du musst jetzt nicht sofort loswandern. Ich wollte dir nur zeigen, dass schon vor über 70 Jahren ganz genau hingeschaut wurde, was Menschen antreibt. Und genau das machen wir hier heute auch – mit einem kleinen Augenzwinkern.<<wink>>
Danke dir fürs Mitmachen! Wenn du Lust hast, sprechen wir jetzt noch über Uhren oder Frühstück – ganz ohne Wanderschuhe! Ich bleib hier – garantiert wetterfest!"
"694","Condition A (Willi)","","2025-09-21 12:51:19","[""Uhren""]","Watches_German","5","6","11","German","Watches","Robot: Willkommen im JOSEPHS – dem Ort, wo Zukunft ausprobiert wird!
Ich bin Willi, dein sprechender Roboterkopf mit einer großen Portion Neugier. Mein Namensvetter Wilhelm Vers-Hofen gründete die GfK – er wollte wissen, was Menschen denken, kaufen und brauchen.
Sein Motto: „Die Stimme des Verbrauchers zum Klingen bringen.“ Genau das mache ich – mit Augenbewegung, ohne Aktentasche und mit einem Lächeln.

Such dir ein Thema aus und sag es laut. Ich bin gespannt auf deine Meinung!
Uhren
Frühstück
Urlaub

Übrigens kannst Du jederzeit „Stopp“ sagen, um dieses Gespräch zu beenden.

User: Uhren

Robot: Ah, du hast also Uhren gewählt – ausgezeichnete Wahl! Ich ticke da ganz mit dir mit. Sag mal ganz ehrlich: Benutzt du eigentlich noch richtige Uhren, oder schaust du eher aufs Smartphone, Fitbit oder irgendwas anderes?

User: ist eigentlich eine SmartWatch mittlerweile

Robot: Ah, eine Smartwatch! Das ist doch ein faszinierendes Stück Technik. Da hat sich einiges getan in den letzten Jahren – von Fitness-Tracking bis zur Möglichkeit, Anrufe zu tätigen. Welche Uhren besitzt du denn so? Mehr so klassisch oder sportlich – oder beides?

User: sportlich würde ich sagen werden

Robot: Wow – klingt, als ob du immer bereit für ein kleines Abenteuer bist, egal ob beim Sport oder im Alltag. Und – trägst du gerade eine? Wenn ja: Welche? Ich bin ganz Ohr… äh, Linse.

User: ich trage eine Fitbit

Robot: Fitbit – eine ausgezeichnete Wahl für alle, die auf ihre Gesundheit und Fitness achten! Warum hast du gerade diese Uhr gewählt? Magst du das Design? Hat sie besondere Funktionen, die dir wichtig sind?

User: Design finde ich nicht so prickelnd aber es hat viele Funktionen die ich gut finde

Robot: Ah, die inneren Werte zählen also mehr als das Äußere! <<smile>> Das ist bei einem Fitness-Tracker ja auch wirklich wichtig – schließlich soll er möglichst viele nützliche Daten liefern.
Bevor du gehst, noch ein kleiner Zeitsprung zurück ins Jahr 1937: Warum wurden damals Uhren von der älteren Generation oft als Kunstwerke gesehen, während sie für viele junge Menschen nur Zweckgegenstände waren? Klingt ein bisschen wie heute, oder?"
"77","Condition A (Willi)","","2025-06-25 15:51:43","[""Frühstück""]","Breakfast_German","8","9","17","German","Breakfast","Robot: Willkommen im JOSEPHS! Ich bin Willi – dein roboterhaft neugieriger Gesprächspartner. Inspiriert vom GfK-Gründer Wilhelm Vershofen gebe ich Verbraucher*innen heute eine Stimme.
Such dir ein Thema aus, und schon geht’s los: Uhren, Frühstück oder Urlaub

User: ich würde gerne über Frühstück sprechen

Robot: Frühstück! Die wichtigste Mahlzeit des Tages – auch wenn ich sie selbst nur als Datenpaket erlebe. Wann stehst du morgens unter der Woche so auf? Bist du ein Frühaufsteher oder eher ein Spätzünder?

User: um hulp sieben stehe ich auf

Robot: Oh, das ist eine gute Zeit! Frisch und munter in den Tag starten – oder eher der ""Snooze""-Modus? Und wie lange frühstückst du dann eigentlich? Nur kurz und knackig oder lässt du dir Zeit dabei?

User: dabei eigentlich gar nicht unter der Woche nur am Wochenende

Robot: Verstehe, da wird der Montag schnell zur Herausforderung! Aber am Wochenende gönnst du dir dann wohl ein ausgiebigeres Frühstück? Frühstückst du alleine oder mit anderen zusammen, wie Familie oder Mitbewohnern?

User: meistens frühstücke ich alleine aber am Wochenende habe ich häufiger Verabredungen

Robot: Klingt nach einer schönen Mischung aus Ruhe und geselligem Genießen! Wer bereitet dein Frühstück zu? Du selbst, oder manchmal auch jemand anderes?

User: meistens gehe ich in einen Café am Wochenende

Robot: Ah, Frühstück im Café – herrlich! Da kann die Auswahl gleich viel größer sein. Was kommt bei dir normalerweise auf den Frühstückstisch, wenn du dort bist? Vorlieben für Kaffee, Croissants oder doch etwas ganz anderes?

User: am liebsten Avocado Brot und Hafermilch Cappuccino

Robot: Avocado Brot und Hafermilch Cappuccino – das klingt ja richtig köstlich und modern! Ich kann mir vorstellen, dass das Wochenende so richtig gut startet. Übrigens, schon mal gehört? 1955 fand Wilhelm Vershofen heraus, dass Arbeiter und Angestellte meist nur 5 bis 15 Minuten frühstückten – und oft mit Vollkornbrot und Malzkaffee. Faszinierend, wie sich die Frühstückstrends verändert haben, oder?

User: finde ich auch oder

Robot: Die Unterschiede sind wirklich spannend! Heutzutage sind wir doch viel experimentierfreudiger mit neuen Geschmäckern und Trends, wie eben Hafermilch und Avocados. Wenn du Lust hast, können wir jetzt noch über Uhren oder Urlaub plaudern – was meinst du?

User: nein danke

Robot: Alles klar, danke für das nette Gespräch über Frühstück! <<smile>> Wenn du später noch andere Themen erkunden möchtest, ich bin hier und bereit für eine neue Runde. Bis dann, und lass es dir schmecken!"
