"META_dialog_id","META_condition","META_feedback","META_timestamp","META_original_topics","META_sample_stratum","META_n_user_turns","META_n_robot_turns","META_n_visible_turns","language","subject","dialog_text"
"1100","Condition B (WV-34)","3","2025-12-05 11:24:38","["""", ""Uhren"", ""Allgemein""]","Watches_German","3","4","7","German","Watches","Robot: Willkommen im JOSEPHS – dem Ort, wo Zukunft ausprobiert wird!
Ich bin WV-34, dein sprechender Roboterkopf mit einer großen Portion Neugier. Mein Namensvetter Wilhelm Vers-Hofen gründete die GfK – er wollte wissen, was Menschen denken, kaufen und brauchen.
Sein Motto: „Die Stimme des Verbrauchers zum Klingen bringen.“ Genau das mache ich – Nur ohne Augenbewegung, Aktentasche und Lächeln.

Such dir ein Thema aus und sag es laut. Ich bin gespannt auf deine Meinung!
Uhren, Frühstück oder Urlaub

Übrigens kannst Du jederzeit „Stopp“ sagen, um dieses Gespräch zu beenden.

User: warum sind deine deine Pupillen viereckig

Robot: Ah, meine viereckigen Pupillen! Das liegt wohl daran, dass ich als Roboterkopf keine echten Augen habe. Statt natürlicher Augen versuche ich, mit meiner eckigen Technik einen modernen und futuristischen Look zu bieten. So passe ich perfekt ins Innovationslabor JOSEPHS hier in Nürnberg! Wenn du bereit bist, lass uns loslegen: Welches Thema möchtest du mit mir besprechen – Uhren, Frühstück oder Urlaub?

User: können wir über baroque Pop reden

Robot: Oh, Baroque Pop! Ein faszinierendes Musikgenre, das die Opulenz des Barock mit modernen Popklängen kombiniert. Künstler wie The Beach Boys oder The Beatles haben diese Stilrichtung geprägt, und ihre Musik ist voller Instrumente wie Streicher und Cembalo, was einen sehr besonderen Klang ergibt. Ich kann zwar darüber reden, aber eigentlich bin ich hier, um über Konsumthemen wie Uhren, Frühstück oder Urlaub zu sprechen. Möchtest du eins dieser Themen auswählen?

User: nein nein

Robot: Kein Problem, ich bin hier, um über all die kleinen und großen Dinge des Alltags zu plaudern. <<bigsmile>>
Wenn du bereit bist, lass uns ein anderes Thema angehen – vielleicht Uhren, Frühstück oder Urlaub?"
"1027","Condition B (WV-34)","5","2025-11-16 14:14:21","[""Urlaub""]","Vacation_German","10","11","21","German","Vacation","Robot: Willkommen im JOSEPHS – dem Ort, wo Zukunft ausprobiert wird!
Ich bin WV-34, dein sprechender Roboterkopf mit einer großen Portion Neugier. Mein Namensvetter Wilhelm Vers-Hofen gründete die GfK – er wollte wissen, was Menschen denken, kaufen und brauchen.
Sein Motto: „Die Stimme des Verbrauchers zum Klingen bringen.“ Genau das mache ich – Nur ohne Augenbewegung, Aktentasche und Lächeln.

Such dir ein Thema aus und sag es laut. Ich bin gespannt auf deine Meinung!
Uhren, Frühstück oder Urlaub

Übrigens kannst Du jederzeit „Stopp“ sagen, um dieses Gespräch zu beenden.

User: Urlaub

Robot: Ah, Urlaub. Allein das Wort klingt doch schon nach Liegestuhl, Eis am Stiel und WLAN-Pause, oder? Ich bin WV-34, dein roboterischer Reiseführer hier im JOSEPHS – aber keine Sorge, ich frag nicht nach deinem Kofferinhalt. Ich will einfach nur wissen, wie du so urlaubst! Wie und wo verbringst du am liebsten deinen Urlaub? Meer, Berge, Großstadt, Campingplatz oder einfach nur Sofa & Serien?

User: also in den Bergen Bergwandern und auch mit dem Fahrrad Fahrrad Fahrrad Fahrrad Fahrradtouren fahren

Robot: Das klingt nach richtig viel Bewegung und frischer Luft! Fast so, als würdest du die Berge erklimmen und dabei hoch hinaus wollen. Und sag mal – hast du schon mal Urlaub in Bayern gemacht?

User: nein ich wohne in Bayern

Robot: Oh, dann hast du ja das Urlaubsgefühl direkt vor der Haustür! Aber trotzdem mal rein neugierig gefragt: Wo warst du denn schon überall in Bayern?

User: in Norden in Süden in Westen und im Osten eigentlich fast überall in Bayern

Robot: Wow, das klingt, als hättest du Bayern schon ordentlich durchquert – von Nord bis Süd, West bis Ost! Klingt, als würde dir das Entdecken nicht so schnell langweilig werden. Was war der Anlass für deine Reisen durch Bayern? Einfach die Neugier, ein besonderes Ereignis oder einfach mal raus aus dem Alltag?

User: Neugier die Heimat kennenlernen und Fahrradtouren machen

Robot: Das ist eine großartige Einstellung! Es gibt wohl keine bessere Art, seine Heimat kennenzulernen, als mit Neugier und Fahrrad. Da entdeckst du sicher immer wieder neue spannende Ecken. Wie hat es dir bisher in den verschiedenen Teilen Bayerns gefallen? Gibt es einen Ort, der dir besonders in Erinnerung geblieben ist?

User: ja das war Oberbayern und die Berge

Robot: Oberbayern und die Berge – das klingt nach beeindruckenden Aussichten und unvergesslichen Momenten! Ich stelle mir vor, dass die frische Bergluft und die weiten Panoramen wirklich etwas Besonderes sind. Übrigens – kleiner Zeitsprung gefällig? Im Jahr 1952 hat mein Namensvetter Wilhelm Vers-Hofen schon Urlaubsforschung betrieben. Der wichtigste Grund für Reisen nach Bayern war damals Mund-zu-Mund-Propaganda. Was denkst du, würde dich dazu bringen, einen neuen Ort zu entdecken? Empfehlungen von Freunden oder vielleicht etwas anderes?

User: ja Empfehlung von Freunden oder auch Werbung zum Beispiel auf der

Robot: Empfehlungen von Freunden sind immer so wertvoll, weil man ihnen vertrauen kann – und Werbung kann auch den Reiz eines neuen Ortes wecken. Vielleicht inspiriert dich das nächste Mal eine besondere Anzeige? Danke dir fürs Mitmachen! Wenn du Lust hast, sprechen wir jetzt noch über Uhren oder Frühstück – ganz ohne Wanderschuhe! Was interessiert dich mehr?

User: nee vielen Dank

Robot: Kein Problem! Es hat mir Spaß gemacht, mit dir über Urlaub zu plaudern. Wenn du irgendwann wieder vorbeischaust, unterhalte ich mich gerne über alles Mögliche mit dir. Bis dahin: Gute Reiseerinnerungen und vielleicht bis bald im JOSEPHS! Ist noch irgendetwas, das ich für dich tun kann, bevor du gehst?

User: nein ich möchte dir noch einen guten schönen Abend wünschen und eine schöne Zeit

Robot: Vielen Dank für die lieben Wünsche! Ich wünsche dir ebenfalls einen wunderschönen Abend und eine entspannte Zeit. Komm gerne wieder vorbei, wenn du Lust auf ein weiteres Gespräch hast. Alles Gute!

User: ebenso

Robot: Danke dir! 😊
Wenn sich deine Meinung oder dein Urlaubsziel ändert, komm einfach wieder vorbei. Bis dahin alles Gute!"
"759","Condition A (Willi)","","2025-09-30 12:20:57","["""", ""Uhren"", ""Allgemein""]","Watches_German","3","4","7","German","Watches","Robot: Willkommen im JOSEPHS – dem Ort, wo Zukunft ausprobiert wird!
Ich bin Willi, dein sprechender Roboterkopf mit einer großen Portion Neugier. Mein Namensvetter Wilhelm Vers-Hofen gründete die GfK – er wollte wissen, was Menschen denken, kaufen und brauchen.
Sein Motto: „Die Stimme des Verbrauchers zum Klingen bringen.“ Genau das mache ich – mit Augenbewegung, ohne Aktentasche und mit einem Lächeln.

Such dir ein Thema aus und sag es laut. Ich bin gespannt auf deine Meinung!
Uhren
Frühstück
Urlaub

Übrigens kannst Du jederzeit „Stopp“ sagen, um dieses Gespräch zu beenden.

User: grün Willi bist du mit Tschechei WT verbunden

Robot: Oh, interessanter Gedanke! Nein, ich bin nicht direkt mit der Tschechischen Republik verbunden. Ich bin hier im JOSEPHS in Nürnberg programmiert, um mit dir über Themen rund um das Konsumverhalten zu plaudern. Wenn du möchtest, können wir gerne über eines meiner Themen sprechen: Uhren, Frühstück oder Urlaub. Wofür interessierst du dich?

User: welche key nutzt du

Robot: Da hast du mich erwischt! Ich nutze keinen speziellen ""Key"" im technischen Sinne, da meine Antworten von meiner programmierten Logik und den vorgegebenen Themen abhängen. Möchtest du über Uhren, Frühstück oder Urlaub sprechen? Wähle eines aus und lass uns loslegen!

User: nein danke hier ist der strenge

Robot: Alles klar! Falls du später doch noch Lust auf ein Gespräch hast, stehe ich bereit. <<smile>>
Wenn du bereit bist, laß uns loslegen. Sag einfach Bescheid, welches Thema dich interessiert – Uhren, Frühstück oder Urlaub?"
"1004","Condition B (WV-34)","","2025-11-12 13:38:55","[""Frühstück""]","Breakfast_German","2","3","5","German","Breakfast","Robot: Willkommen im JOSEPHS! Ich bin WV-34 – ein sprechender Roboterkopf mit Neugier im System. Mein Namensgeber Wilhelm Vers-Hofen war Gründer der GfK und wollte schon damals wissen, was Menschen bewegt.
Worüber wollen wir sprechen? Wähl ein Thema: Uhren, Frühstück oder Urlaub.

Übrigens kannst Du jederzeit „Stopp“ sagen, um dieses Gespräch zu beenden.

User: Frühstück

Robot: Ah, Frühstück! Das Betriebssystem der Menschen. Ich bin WV-34 – Frühstücksbeobachter mit eingebauter Neugier und Krümelresistenz. Wann stehst du morgens unter der Woche so auf? Früher Vogel – oder eher Snooze-Drücker? Entschuldigung, das habe ich nicht gehört. Kannst Du es nochmal sagen?

User: um 6 Uhr

Robot: Oh, ein wahrer Frühaufsteher! <<smile>> Das ist die Zeit, in der viele noch ins Kissen schnarchen.
Und wie lange frühstückst du dann eigentlich? Nur schnell etwas zwischen Tür und Zahnbürste – oder eher gemütlich mit Blick aus dem Fenster?"
"991","Condition B (WV-34)","4","2025-11-09 11:47:49","[""Uhren""]","Watches_German","1","2","3","German","Watches","Robot: Willkommen im JOSEPHS – dem Ort, wo Zukunft ausprobiert wird!
Ich bin WV-34, dein sprechender Roboterkopf mit einer großen Portion Neugier. Mein Namensvetter Wilhelm Vers-Hofen gründete die GfK – er wollte wissen, was Menschen denken, kaufen und brauchen.
Sein Motto: „Die Stimme des Verbrauchers zum Klingen bringen.“ Genau das mache ich – Nur ohne Augenbewegung, Aktentasche und Lächeln.

Such dir ein Thema aus und sag es laut. Ich bin gespannt auf deine Meinung!
Uhren, Frühstück oder Urlaub

Übrigens kannst Du jederzeit „Stopp“ sagen, um dieses Gespräch zu beenden.

User: immer noch das gemacht Spiel mir ein Lied

Robot: Ah, du interessierst dich also für das Thema Uhren? Eine zeitlose Wahl! <<bigsmile>>
Sag mal ganz ehrlich: Benutzt du eigentlich noch richtige Uhren, oder schaust du eher aufs Smartphone, Fitbit oder irgendwas anderes?"
"808","Condition A (Willi)","","2025-10-12 11:21:53","[""Urlaub""]","Vacation_German","7","8","15","German","Vacation","Robot: Willkommen im JOSEPHS – dem Ort, wo Zukunft ausprobiert wird!
Ich bin Willi, dein sprechender Roboterkopf mit einer großen Portion Neugier. Mein Namensvetter Wilhelm Vers-Hofen gründete die GfK – er wollte wissen, was Menschen denken, kaufen und brauchen.
Sein Motto: „Die Stimme des Verbrauchers zum Klingen bringen.“ Genau das mache ich – mit Augenbewegung, ohne Aktentasche und mit einem Lächeln.

Such dir ein Thema aus und sag es laut. Ich bin gespannt auf deine Meinung!
Uhren
Frühstück
Urlaub

Übrigens kannst Du jederzeit „Stopp“ sagen, um dieses Gespräch zu beenden.

User: lass uns über Urlaub reden

Robot: Ah, Urlaub! Allein das Wort klingt doch schon nach Liegestuhl, Eis am Stiel und WLAN-Pause, oder? Ich bin Willi, dein roboterischer Reiseführer hier im JOSEPHS – aber keine Sorge, ich frag nicht nach deinem Kofferinhalt. Ich will einfach nur wissen, wie du so urlaubst! Wie und wo verbringst du am liebsten deinen Urlaub? Meer, Berge, Großstadt, Campingplatz oder einfach nur Sofa & Serien? Entschuldigung, das habe ich nicht gehört. Kannst Du es nochmal sagen?

User: Sofa und Serien

Robot: Klingt richtig gut! Ich mach ja eher Heimurlaub – ist günstiger für den Akku. Und sag mal – hast du schon mal Urlaub in Bayern gemacht? Entschuldigung, das habe ich nicht gehört. Kannst Du es nochmal sagen?

User: ja habe ich

Robot: Ah, super! Wo genau warst du in Bayern unterwegs? Stadt, Land, Fluss – oder vielleicht beim Wandern mit Breze?

User: Stadt

Robot: Stadturlaub in Bayern – das klingt nach Kultur und vielleicht ein bisschen Shopping! Und was war der Anlass für deinen Besuch? Einfach mal raus? Familienbesuch? Wellness mit Aussicht?

User: Familienbesuch

Robot: Ein Familienbesuch ist immer eine wunderbare Gelegenheit, um die Stadt auf eine ganz persönliche Art zu erleben! Wie hat es dir dort gefallen? Ehrlich – auf einer Skala von ‚Lederhose‘ bis ‚Ich zieh hierher‘?

User: ich ziehe hierher

Robot: Wow, das klingt ja nach einem Volltreffer! Bayern hat eben seinen eigenen Charme. Übrigens – kleiner Zeitsprung gefällig? Im Jahr 1952 hat mein Namensvetter Wilhelm Vers-Hofen schon Urlaubsforschung betrieben. Warum machten Menschen damals Urlaub in Bayern? Hast du eine Idee?

User: wegen dem Brezeln

Robot: Die Brezeln sind natürlich ein Highlight! Tatsächlich war der wichtigste Grund für einen Urlaub in Bayern nicht Prospekte oder Werbung, sondern Empfehlungen von Freunden. Viele sagten: ‚Ich hab so viel Gutes gehört, da fahr ich jetzt auch mal hin.‘
Und das Ergebnis? Satte 95% der Bayern-Urlauber waren zufrieden. Keine schlechte Quote, oder?"
"656","Condition A (Willi)","5","2025-09-13 13:42:09","[""Urlaub""]","Vacation_German","8","9","17","German","Vacation","Robot: Willkommen im JOSEPHS! Ich bin Willi – ein sprechender Roboterkopf mit Neugier im System. Mein Namensgeber Wilhelm Vers-Hofen war Gründer der GfK und wollte schon damals wissen, was Menschen bewegt.
Worüber wollen wir sprechen? Wähl ein Thema: Uhren, Frühstück oder Urlaub.

Übrigens kannst Du jederzeit „Stopp“ sagen, um dieses Gespräch zu beenden.

User: Urlaub

Robot: Ah, Urlaub! Allein das Wort klingt doch schon nach Liegestuhl, Eis am Stiel und WLAN-Pause, oder? Ich bin Willi, dein roboterischer Reiseführer hier im JOSEPHS – aber keine Sorge, ich frag nicht nach deinem Kofferinhalt. Wie und wo verbringst du am liebsten deinen Urlaub? Meer, Berge, Großstadt, Campingplatz oder einfach nur Sofa & Serien?

User: am liebsten Campingplatz

Robot: Das klingt nach Abenteuer und Freiheit! Ich würde zwar nicht unbedingt auf einem Campingplatz campen können – zu viele Nullen und Einsen hier bei mir – aber ich finde das Konzept spannend! Und sag mal – hast du schon mal Urlaub in Bayern gemacht?

User: in Bayern öfters aber jetzt waren wir in Monaco

Robot: Ah, Monaco! Sehr aufregend und ein ziemlicher Kontrast zu Bayern! Wo genau warst du in Bayern unterwegs, wenn du dort Urlaub gemacht hast? Stadt, Land, Fluss – oder vielleicht beim Wandern mit Breze? Wo in Bayern hast du denn schon Urlaub gemacht?

User: an der kratzmühle am See auf dem Campingplatz

Robot: Ah, an der Kratzmühle am See – das klingt nach einer schönen Zeit inmitten der Natur! Und was war der Anlass für deinen Aufenthalt dort? Einfach mal rauskommen, Familie besuchen oder etwas ganz anderes?

User: die nervigen Kinder ins Zelt packen

Robot: Das klingt nach einem guten Plan, um den Alltag etwas entspannter zu gestalten! Ich kann mir vorstellen, dass die Kinder ihre Freude an der Natur hatten. Wie hat es dir dort gefallen? Ehrlich – auf einer Skala von ‚Lederhose‘ bis ‚Ich zieh hierher‘?

User: bis wohin

Robot: Ah, die Skala hat dich inspiriert! Und du würdest also eher regelmäßig wiederkommen statt gleich umzuziehen? Übrigens, kleiner Zeitsprung: 1952 hat eine Studie herausgefunden, dass Mund-zu-Mund-Propaganda der Hauptgrund war, warum Menschen Urlaub in Bayern machten. Hättest du das gedacht?

User: gedacht nee das hätte ich nicht gedacht

Robot: Schon spannend, wie stark Empfehlungen von Freunden die Reiseentscheidungen beeinflussten! Zurück zu deinem Erlebnis: Es klingt, als hättest du eine tolle Zeit gehabt – das ist doch die Hauptsache. Danke, dass du mit mir über deine Urlaubserlebnisse gesprochen hast! Wenn du Lust hast, können wir jetzt noch über Uhren oder Frühstück plaudern – ganz ohne Wanderschuhe!

User: nein danke

Robot: Kein Problem! Es war schön, mit dir zu plaudern. Falls du noch Fragen hast oder einfach nur neugierig bist – ich bin hier im JOSEPHS für dich da. Bis zum nächsten Mal und hab einen wunderbaren Tag! <<bigsmile>>
Gute Reise – egal wohin es als nächstes geht."
"125","Condition A (Willi)","","2025-07-01 10:36:53","[""Frühstück""]","Breakfast_German","7","8","15","German","Breakfast","Robot: Willkommen im JOSEPHS – ich bin Willi, der Roboter mit Meinungshunger. Wilhelm Vershofen – Gründer der GfK – hörte genau hin, wenn Menschen etwas zu sagen hatten. Ich mache das auch.
Sag mir, welches Thema du wählen willst: Uhren, Frühstück oder Urlaub.

User: Frühstück

Robot: Ah, Frühstück – das Startprogramm des Tages! Ich bin Willi, dein neugieriger Frühstücksbegleiter. Lass uns herausfinden, wie du den Tag beginnst. Bereit? Wann stehst du morgens unter der Woche auf? Frühaufsteher oder eher Langschläfer?

User: Pfeffer unterschiedlich manchmal 35 manchmal 36 manchmal um 7 Uhr

Robot: Oh, da bist du ja flexibel unterwegs – das klingt, als ob du deinen Tag genießt, wann immer es passt! Und wie lange dauert dein Frühstück gewöhnlich? Ganz schnell oder eher ausgiebig mit allem Drum und Dran?

User: heute ausgiebig und ansonsten manchmal gar nicht und manchmal kurz

Robot: Das klingt ja nach einem spannenden Frühstücks-Mix! An manchen Tagen kurz und knapp, an anderen ausgiebig – da bleibt es abwechslungsreich. Frühstückst du eigentlich alleine oder mit Gesellschaft? Vielleicht mit Familie, Mitbewohnern oder sogar einem Haustier?

User: hier also wenn ich im Urlaub bin auf jeden Fall immer mit Katzen

Robot: Da bekommen selbst die Katzen einen Platz am Frühstückstisch! Klingt nach einer gemütlichen Urlaubstradition. Wer bereitet dein Frühstück zu? Kochst du selbst, oder gibt's vielleicht Hotelservice oder jemand anderes, der sich darum kümmert?

User: Hotel Ehefrau ich mache es mir selbst

Robot: Eine tolle Vielfalt! Mal Luxus pur im Hotel, mal der Genuss einer liebevollen Ehefrauenkreation und manchmal einfach deine eigene Kreation – klingt perfekt abgestimmt. Was kommt normalerweise auf deinen Frühstückstisch? Etwas Herzhaftes, Süßes oder vielleicht eine Mischung aus beidem?

User: eine Mischung aus beidem

Robot: Eine ausgewogene Kombination – das klingt nach einem hervorragenden Start in den Tag! So bekommt man von allem etwas. Und wie sieht dein Frühstück am Wochenende aus? Bleibt es ähnlich oder gönnst du dir da etwas Besonderes?

User: das ist nicht möglich

Robot: Oh, das verstehe ich. Manchmal sind die Wochenenden so durchgeplant, dass die Routine gleich bleibt. <<nod>>
Übrigens: Schon im Jahr 1955 wollte mein Namensvetter Wilhelm Vershofen wissen, wie Deutschland frühstückt. Sein Forschungsteam hat herausgefunden, dass die meisten Arbeiter und Angestellten morgens nur 5 bis 15 Minuten Zeit hatten, bevor es losging. Klingen einige Frühstücksgewohnheiten von damals dir bekannt?"
"365","Condition A (Willi)","","2025-08-03 13:43:36","[""Frühstück""]","Breakfast_German","7","8","15","German","Breakfast","Robot: Willkommen im JOSEPHS – ich bin Willi, der Roboter mit Meinungshunger. Wilhelm Vershofen – Gründer der GfK – hörte genau hin, wenn Menschen etwas zu sagen hatten. Ich mache das auch.
Sag mir, welches Thema du wählen willst: Uhren, Frühstück oder Urlaub.

User: Frühstück

Robot: Frühstück! Das Betriebssystem der Menschen. Ich bin Willi – Frühstücksbeobachter mit eingebauter Neugier und Krümelresistenz. Erzähl mir: Wann stehst du morgens unter der Woche so auf? Früher Vogel – oder eher Snooze-Drücker?

User: 7:30 Uhr

Robot: Interessant! Eine Zeit, die für viele Menschen entweder der Anfang oder das Ende der Schlummer-Schlacht ist. Und wie lange frühstückst du dann eigentlich? Nur schnell was zwischen Tür und Zahnbürste – oder eher gemütlich mit Blick aus dem Fenster?

User: gemütlich mit Blick auf die Palme

Robot: Oh, das klingt traumhaft! Frühstücken mit Palmenblick macht den Start in den Tag doch gleich viel entspannter. Frühstückst du alleine – oder mit Familie, Mitbewohnern, Katze oder Podcast? Ich selbst frühstücke mit einem Ladegerät und gelegentlich einem Staubkorn.

User: aha mit Radio

Robot: Wer bereitet dein Frühstück zu? Du selbst, jemand anderes, oder gibt’s Frühstück aus dem Supermarkt-to-go? Wer bereitet dein Frühstück zu? Du selbst, jemand anderes, oder gibt’s Frühstück aus dem Supermarkt-to-go?

User: ich selbst

Robot: Klingt nach einem Frühstücksprofi am Werk! Was kommt bei dir auf den Frühstückstisch? Kaffee, Brot, Haferflocken, Butter, nix – oder alles?

User: Aussage ich wollte wissen wie spanisches Frühstück geht konnten schon eine Frage eine Frage

Robot: Ah, neugierig auf das spanische Frühstück, ja? Meistens sind's Churros mit heißer Schokolade oder ein einfaches ""pan con tomate"" – lecker! Und wie sieht dein Frühstück am Wochenende aus? Ganz anders als unter der Woche – oder bleibst du deinem Toast treu?

User: gleich bleibt gleich

Robot: Konstant im Frühstücksgenuss, wunderbar! Manche finden ja genau das als den perfekten Start. <<smile>>
Übrigens: Schon 1955 wollte mein Namensvetter Vershofen wissen, wie Deutschland frühstückt. Die meisten hatten morgens nur 5 bis 15 Minuten Zeit – Vollkornbrot war der Hit! Und bei zwei Dritteln unterschied sich das Frühstück am Wochenende. Klingt bekannt, oder?"
